39231	9621	Drew Baylor is fired after causing his shoe company to lose hundreds of millions of dollars. To make matters worse, he's also dumped by his girlfriend. On the verge of ending it all, Drew gets a new lease on life when he returns to his family's small Kentucky hometown after his father dies. Along the way, he meets a flight attendant with whom he falls in love.	https://image.tmdb.org/t/p/w1280/Asn50mIjDaeDKbaJkQ7lY6goV8p.jpg
2028	857	As U.S. troops storm the beaches of Normandy, three brothers lie dead on the battlefield, with a fourth trapped behind enemy lines. Ranger captain John Miller and seven men are tasked with penetrating German-held territory and bringing the boy home.	https://image.tmdb.org/t/p/w1280/miDoEMlYDJhOCvxlzI0wZqBs9Yt.jpg
46578	773	A family loaded with quirky, colorful characters piles into an old van and road trips to California for little Olive to compete in a beauty pageant.	https://image.tmdb.org/t/p/w1280/5ZuviyEOkelod8x5j5CWa45jsw2.jpg
3114	863	Andy heads off to Cowboy Camp, leaving his toys to their own devices. Things shift into high gear when an obsessive toy collector named Al McWhiggen, owner of Al's Toy Barn kidnaps Woody. Andy's toys mount a daring rescue mission, Buzz Lightyear meets his match and Woody has to decide where he and his heart truly belong.	https://image.tmdb.org/t/p/w1280/3CmK3XurcLeUyMifCR28ibzupbB.jpg
6383	584	"It's a major double-cross when former police officer Brian O'Conner teams up with his ex-con buddy Roman Pearce to transport a shipment of ""dirty"" money for shady Miami-based import-export dealer Carter Verone. But the guys are actually working with undercover agent Monica Fuentes to bring Verone down."	https://image.tmdb.org/t/p/w1280/hZVcmztCVo510FhBXyLqStiTAce.jpg
2816	11955	Chappy Sinclair is called to gather together a mixed Soviet/U.S. strike force that will perform a surgical strike on a massively defended nuclear missile site in the Middle East. Chappy finds that getting the Soviet and U.S. Pilots to cooperate is only the most minor of his problems as he discovers someone in the Pentagon is actively sabotaging his mission.	https://image.tmdb.org/t/p/w1280/fWqhxzwGW45NO7PtJWQbiS8hO01.jpg
1748	2666	A man struggles with memories of his past, including a wife he cannot remember, in a nightmarish world with no sun and run by beings with telekinetic powers who seek the souls of humans.	https://image.tmdb.org/t/p/w1280/yR7rapBFxBoBT0vkZQIXhLBr726.jpg
5218	425	With the impending ice age almost upon them, a mismatched trio of prehistoric critters – Manny the woolly mammoth, Diego the saber-toothed tiger and Sid the giant sloth – find an orphaned infant and decide to return it to its human parents. Along the way, the unlikely allies become friends but, when enemies attack, their quest takes on far nobler aims.	https://image.tmdb.org/t/p/w1280/zpaQwR0YViPd83bx1e559QyZ35i.jpg
5219	1576	When a virus leaks from a top-secret facility, turning all resident researchers into ravenous zombies and their lab animals into mutated hounds from hell, the government sends in an elite military task force to contain the outbreak. Alice and Rain are charged with leading the mission. But they only have three hours before the pathogen becomes airborne and infects the world.	https://image.tmdb.org/t/p/w1280/fttmSgLEOdBNwQepW2lC6t0mbOm.jpg
4167	2749	"When Eastern European criminals Oleg and Emil come to New York City to pick up their share of a heist score, Oleg steals a video camera and starts filming their activities, both legal and illegal. When they learn how the American media circus can make a remorseless killer look like the victim and make them rich, they target media-savvy NYPD Homicide Detective Eddie Flemming and media-naive FDNY Fire Marshal Jordy Warsaw, the cops investigating their murder and torching of their former criminal partner, filming everything to sell to the local tabloid TV show ""Top Story."""	https://image.tmdb.org/t/p/w1280/qqqleHV8y7NLKt7isSZAvOwVPH6.jpg
1968	2108	Five disparate high school students meet in Saturday detention, and discover they have a lot more in common than they thought.	https://image.tmdb.org/t/p/w1280/4ZejrrCpfoypR5lHoT3pq6yVldW.jpg
43708	292	The American comedian/actor delivers a story about the alternative Hip Hop scene. A small town Ohio man’s moves to Brooklyn, New York, to throw an unprecedented block party.	https://image.tmdb.org/t/p/w1280/lGS9iKGGRjM049ZGK4J8TvQeBHg.jpg
1616	6623	When a train carrying atomic warheads mysteriously crashes in the former Soviet Union, a nuclear specialist discovers the accident is really part of a plot to cover up the theft of the weapons. Assigned to help her recover the missing bombs is a crack Special Forces Colonel.	https://image.tmdb.org/t/p/w1280/hc3p6pvIrfO4AmrVLb6qTviOwW2.jpg
1617	2118	Three detectives in the corrupt and brutal L.A. police force of the 1950s use differing methods to uncover a conspiracy behind the shotgun slayings of the patrons at an all-night diner.	https://image.tmdb.org/t/p/w1280/rIXzJCAvyd3Ci8ipylDQ5wUKqwh.jpg
1615	9433	The plane carrying wealthy Charles Morse crashes down in the Alaskan wilderness. Together with the two other passengers, photographer Robert and assistant Stephen, Charles devises a plan to help them reach civilization. However, his biggest obstacle might not be the elements, or even the Kodiak bear stalking them -- it could be Robert, whom Charles suspects is having an affair with his wife and would not mind seeing him dead.	https://image.tmdb.org/t/p/w1280/fvokkKZuhMosdpABHduMdOdIDkp.jpg
1961	380	Selfish yuppie Charlie Babbitt's father left a fortune to his savant brother Raymond and a pittance to Charlie; they travel cross-country.	https://image.tmdb.org/t/p/w1280/vllKYkA7eYi2UMM9yWQ1JegefBh.jpg
1610	1669	A new, technologically-superior Soviet sub, the Red October, is heading for the U.S. coast under the command of Captain Marko Ramius. The American government thinks Ramius is planning to attack. A lone CIA analyst has a different idea: he thinks Ramius is planning to defect, but he has only a few hours to find him and prove it — because the entire Russian naval and air commands are trying to find him, too.	https://image.tmdb.org/t/p/w1280/bqvlKYlWq2uibsuVzKTWseeccd2.jpg
45	577	Suzanne Stone wants to be a world-famous news anchor and she is willing to do anything to get what she wants. What she lacks in intelligence, she makes up for in cold determination and diabolical wiles. As she pursues her goal with relentless focus, she is forced to destroy anything and anyone that may stand in her way, regardless of the ultimate cost or means necessary.	https://image.tmdb.org/t/p/w1280/zCREx8trzejNieDLUsRuwLU0cS3.jpg
327	9067	Based on the British cult comic-strip, our tank-riding anti-heroine fights a mega-corporation, which controls the world's water supply.	https://image.tmdb.org/t/p/w1280/n3QWQhb5oVJxTLNKMLmA9xC5XwB.jpg
3977	4327	Three women, detectives with a mysterious boss, retrieve stolen voice-ID software, using martial arts, tech skills, and sex appeal.	https://image.tmdb.org/t/p/w1280/eBzf9d09Vgq2HSVC4fIZm1QNQd.jpg
329	193	Captain Jean-Luc Picard and the crew of the Enterprise-D find themselves at odds with the renegade scientist Soran who is destroying entire star systems. Only one man can help Picard stop Soran's scheme...and he's been dead for seventy-eight years.	https://image.tmdb.org/t/p/w1280/wjrXjlNpDq9U8vYmAwf420yDFtn.jpg
204	3512	A passenger train has been hijacked by an electronics expert and turned into an untraceable command center for a weapons satellite. He has planned to blow up Washington DC and only one man can stop him, former Navy SEAL Casey Ryback.	https://image.tmdb.org/t/p/w1280/6Z1p71nkm45cYuIZWOx5JSCYc0o.jpg
208	9804	In a futuristic world where the polar ice caps have melted and made Earth a liquid planet, a beautiful barmaid rescues a mutant seafarer from a floating island prison. They escape, along with her young charge, Enola, and sail off aboard his ship. But the trio soon becomes the target of a menacing pirate who covets the map to 'Dryland' – which is tattooed on Enola's back.	https://image.tmdb.org/t/p/w1280/9I0z3rM8gdIyjHBTIYniFXiwFOo.jpg
3623	955	With computer genius Luther Stickell at his side and a beautiful thief on his mind, agent Ethan Hunt races across Australia and Spain to stop a former IMF agent from unleashing a genetically engineered biological weapon called Chimera. This mission, should Hunt choose to accept it, plunges him into the center of an international crisis of terrifying magnitude.	https://image.tmdb.org/t/p/w1280/di800v3Racf2FQ1ObZ1dskgS0px.jpg
778	627	Mark Renton, deeply immersed in the Edinburgh drug scene, tries to clean up and get out, despite the allure of the drugs and influence of friends.	https://image.tmdb.org/t/p/w1280/p1O3eFsdb0GEIYu87xlwV7P4jM1.jpg
76	9102	SIRIUS 6B, Year 2078. On a distant mining planet ravaged by a decade of war, scientists have created the perfect weapon: a blade-wielding, self-replicating race of killing devices known as Screamers designed for one purpose only -- to hunt down and destroy all enemy life forms.	https://image.tmdb.org/t/p/w1280/aFEs7D7IQ2IehTsniRIojDkiDl6.jpg
7102	10023	LAPD Sgt. Joe Friday -- the equally straight-laced nephew of the famous police sergeant of the same name -- is paired up with a young, freewheeling detective named Pep Streebeck. After investigating some strange robberies at the local zoo and the theft of a stockpile of pornographic magazines, they uncover cult activity in the heart of the city and are hot on the case to figure out who's behind it all.	https://image.tmdb.org/t/p/w1280/vaFsRAleYZ6tIPxrDP2iwUpO3kU.jpg
70	755	Seth Gecko and his younger brother Richard are on the run after a bloody bank robbery in Texas. They escape across the border into Mexico and will be home-free the next morning, when they pay off the local kingpin. They just have to survive 'from dusk till dawn' at the rendezvous point, which turns out to be a Hell of a strip joint.	https://image.tmdb.org/t/p/w1280/ce0d4kM5KxT4x1Oq8JkSuNYevri.jpg
3052	1832	The latest battle in the eternal war between Good and Evil has come to New Jersey in the late, late 20th Century. Angels, demons, apostles and prophets (of a sort) walk among the cynics and innocents of America and duke it out for the fate of humankind.	https://image.tmdb.org/t/p/w1280/zuJJAEvyiZiddzRx7JRGNDzjP07.jpg
3578	98	In the year 180, the death of emperor Marcus Aurelius throws the Roman Empire into chaos.  Maximus is one of the Roman army's most capable and trusted generals and a key advisor to the emperor.  As Marcus' devious son Commodus ascends to the throne, Maximus is set to be executed.  He escapes, but is captured by slave traders.  Renamed Spaniard and forced to become a gladiator, Maximus must battle to the death with other men for the amusement of paying audiences.	https://image.tmdb.org/t/p/w1280/6WBIzCgmDCYrqh64yDREGeDk9d3.jpg
1041	11159	A middle-aged London factory worker is shocked when the mixed-race daughter she gave up at birth decides to track her down. At first she denies she is her mother. All family members become emotional, as everyone's secrets are exposed.	https://image.tmdb.org/t/p/w1280/8uinoRlLK1wh2l7l7P2PqnuxRiS.jpg
1047	11412	Samantha Caine, suburban homemaker, is the ideal mom to her 8 year old daughter Caitlin. She lives in Honesdale, PA, has a job teaching school and makes the best Rice Krispie treats in town. But when she receives a bump on her head, she begins to remember small parts of her previous life as a lethal, top-secret agent.	https://image.tmdb.org/t/p/w1280/4MENR8x6mYqnZvp2hGjSaPJz64J.jpg
2335	10663	Bobby Boucher is a water boy for a struggling college football team. The coach discovers Boucher's hidden rage makes him a tackling machine whose bone-crushing power might vault his team into the playoffs.	https://image.tmdb.org/t/p/w1280/wZKa2NZgEKJ85NoO2cQ7xzj8eBn.jpg
3527	106	Dutch and his group of commandos are hired by the CIA to rescue downed airmen from guerillas in a Central American jungle. The mission goes well but as they return they find that something is hunting them. Nearly invisible, it blends in with the forest, taking trophies from the bodies of its victims as it goes along. Occasionally seeing through its eyes, the audience sees it is an intelligent alien hunter, hunting them for sport, killing them off one at a time.	https://image.tmdb.org/t/p/w1280/gUpto7r2XwoM5eW7MUvd8hl1etB.jpg
2231	10220	A young man is a reformed gambler who must return to playing big stakes poker to help a friend pay off loan sharks.	https://image.tmdb.org/t/p/w1280/j5IzmdWdO5CqgeoyJLZ1dO7w375.jpg
1049	10586	Sir Robert Beaumont is behind schedule on a railroad in Africa. Enlisting noted engineer John Henry Patterson to right the ship, Beaumont expects results. Everything seems great until the crew discovers the mutilated corpse of the project's foreman, seemingly killed by a lion. After several more attacks, Patterson calls in famed hunter Charles Remington, who has finally met his match in the bloodthirsty lions.	https://image.tmdb.org/t/p/w1280/3KEPs6RKlin9pT9fqjtW7MSLC8H.jpg
4718	2770	The whole gang are back and as close as ever. They decide to get even closer by spending the summer together at a beach house. They decide to hold the biggest party ever to be seen, even if the preparation doesn't always go to plan. Especially when Stifler, Finch and Jim become more close to each other than they ever want to be and when Jim mistakes super glue for lubricant...	https://image.tmdb.org/t/p/w1280/q4LNgUnRfltxzp3gf1MAGiK5LhV.jpg
4719	12610	A policeman white blood cell, with the help of a cold pill, must stop a deadly virus from destroying the human they live in, Frank.	https://image.tmdb.org/t/p/w1280/foZpSG88IQUCEBJE3unc5QzO6bQ.jpg
5445	180	John Anderton is a top 'Precrime' cop in the late-21st century, when technology can predict crimes before they're committed. But Anderton becomes the quarry when another investigator targets him for a murder charge.	https://image.tmdb.org/t/p/w1280/h3lpltSn7Rj1eYTPQO1lYGdw4Bz.jpg
51662	1271	"Based on Frank Miller's graphic novel, ""300"" is very loosely based the 480 B.C. Battle of Thermopylae, where the King of Sparta led his army against the advancing Persians; the battle is said to have inspired all of Greece to band together against the Persians, and helped usher in the world's first democracy."	https://image.tmdb.org/t/p/w1280/bYR8O1H1ZlME7Dm9ysfTYZnRDpw.jpg
1769	11702	Hired assassin John Lee is asked by Chinatown crime boss Terence Wei to murder the young son of policeman Stan Zedkov. Lee has the boy in his sights, but his conscience gets the better of him, and he spares the child's life. Afraid that Wei will take revenge on his family in China, Lee seeks out expert forger Meg Coburn to obtain the passport he needs to get out of the country, but a band of replacement killers is soon on his trail.	https://image.tmdb.org/t/p/w1280/w3a8vGtEyCPypK1muKOO6h1VLAY.jpg
1687	4824	Hired by a powerful member of the Russian mafia to avenge an FBI sting that left his brother dead, a psychopathic hitman known only as The Jackal proves an elusive target for the people charged with the task of bringing him down: a deputy FBI director, a Russian MVK Major,  and a jailed IRA terrorist who can recognize him.	https://image.tmdb.org/t/p/w1280/6Hh2ROGTRKdbUfEXVVv5fNhmXK3.jpg
1760	6116	"Zany adventure that follows The Spice Girls and their entourage (mostly fictional characters) - manager Clifford, his assistant Deborah,  and filmmaker Piers (who is trying to shoot a documentary on ""the real Spice Girls"")."	https://image.tmdb.org/t/p/w1280/vcFop91huEWlGh8c1qoehfTZ8OJ.jpg
46976	1262	Harold Crick is a lonely IRS agent whose mundane existence is transformed when he hears a mysterious voice narrating his life.	https://image.tmdb.org/t/p/w1280/AtjCCvfMq9kmjwjbVwTJ0mWG7zp.jpg
49530	1372	An ex-mercenary turned smuggler. A Mende fisherman. Amid the explosive civil war overtaking 1999 Sierra Leone, these men join for two desperate missions: recovering a rare pink diamond of immense value and rescuing the fisherman's son conscripted as a child soldier into the brutal rebel forces ripping a swath of torture and bloodshed countrywide.	https://image.tmdb.org/t/p/w1280/wRamTzV6udKaMXrspxqOuo02zk0.jpg
7812	10941	Susan Ivanova discovers a derelict spaceship in hyperspace. They tow it back to Babylon 5, then strange things start happening. People are being telepathically taken over by aliens from another (third)space.	https://image.tmdb.org/t/p/w1280/7MDbTFO2qqQ7gCE3o7jJG5neLp3.jpg
1147	10548	"It's 1974. Muhammad Ali is 32 and thought by many to be past his prime. George Foreman is ten years younger and the heavyweight champion of the world. Promoter Don King wants to make a name for himself and offers both fighters five million dollars apiece to fight one another, and when they accept, King has only to come up with the money. He finds a willing backer in Mobutu Sese Suko, the dictator of Zaire, and the ""Rumble in the Jungle"" is set, including a musical festival featuring some of America's top black performers, like James Brown and B.B. King."	https://image.tmdb.org/t/p/w1280/wAw3KIEuQGIwhCBWtvWFQRItz0d.jpg
7810	10916	"Allies of the Shadows seek revenge against humanity. This movie sets up the series, ""Crusade,"" the sequel to ""Babylon 5."""	https://image.tmdb.org/t/p/w1280/o4HS0KZl0Rny1reNx6gRKEDsyOk.jpg
6966	9556	Dr. Peyton Westlake is on the verge of realizing a major breakthrough in synthetic skin when his laboratory is destroyed by gangsters. Having been burned beyond recognition and forever altered by an experimental medical procedure, Westlake becomes known as Darkman, assuming alternate identities in his quest for revenge and a new life with a former love.	https://image.tmdb.org/t/p/w1280/hHEliLwA6NVJQUBKshzweG7GG1S.jpg
666	27098	This film is set in 1943 when the whole of Europe was embroiled in WWII. It deals with attraction of a 15 year old boy Stig to his teacher Viola. The whole movie revolves around the sexual encounters between Stig and Viola and how he eventually grows out of it.	https://image.tmdb.org/t/p/w1280/uJD0PvYGAa1IoZBsX4E6GQ4K2In.jpg
1148	531	Gromit finds himself being pushed out of his room and home by a new lodger who is actually a ruthless criminal (and a small penguin). The penguin is planning a robbery and needs to use Wallace and his mechanical remote controlled trousers to pull off the raid. However, Gromit is wise to the penguin and comes to the rescue.	https://image.tmdb.org/t/p/w1280/O3fFWazkIL1QrmH5t9numsUgmR.jpg
4308	824	A celebration of love and creative inspiration takes place in the infamous, gaudy and glamorous Parisian nightclub, at the cusp of the 20th century. A young poet, who is plunged into the heady world of Moulin Rouge, begins a passionate affair with the club's most notorious and beautiful star.	https://image.tmdb.org/t/p/w1280/xhuQz2yKPlWvMvvnf2u9RVkAQx6.jpg
8622	1777	Michael Moore's view on what happened to the United States after September 11; and how the Bush Administration allegedly used the tragic event to push forward its agenda for unjust wars in Afghanistan and Iraq.	https://image.tmdb.org/t/p/w1280/vZYGLqVV4qnAknyxnFrhDQNl1SS.jpg
4571	1648	"A pair of failing high school students—Bill S. Preston, Esquire and Ted ""Theodore"" Logan—are visited by a time traveler from the future, who takes them on an adventure through time to gather up actual historical figures to help them with a history report."	https://image.tmdb.org/t/p/w1280/b2yKJ1STPklVSRtso2Tg4TPXK7u.jpg
33834	11683	The world is full of zombies and the survivors have barricaded themselves inside a walled city to keep out the living dead. As the wealthy hide out in skyscrapers and chaos rules the streets, the rest of the survivors must find a way to stop the evolving zombies from breaking into the city.	https://image.tmdb.org/t/p/w1280/1VYvkSiyJg9Za2R5KSHjUygLKEq.jpg
3388	8989	"Returning from a hunting trip in the forest, the Henderson family's car hits an animal in the road. At first they fear it was a man, but when they examine the ""body"" they find it's a ""bigfoot"". They think it's dead so they decide to take it home (there could be some money in this). As you guessed, it isn't dead. Far from being the ferocious monster they fear ""Harry"" to be, he's a friendly giant."	https://image.tmdb.org/t/p/w1280/mhpajPCVjE3y4wgDLichDF5Peq8.jpg
5507	7451	"Xander Cage is your standard adrenaline junkie with no fear and a lousy attitude. When the US Government ""recruits"" him to go on a mission, he's not exactly thrilled. His mission: to gather information on an organization that may just be planning the destruction of the world, led by the nihilistic Yorgi."	https://image.tmdb.org/t/p/w1280/86BnliVDBo2TjKmrgQTJIPHxAKd.jpg
8781	14462	Years after his squad was ambushed during the Gulf War, Major Ben Marco finds himself having terrible nightmares. He begins to doubt that his fellow squad-mate Sergeant Raymond Shaw, now a vice-presidential candidate, is the hero he remembers him being. As Marco's doubts deepen, Shaw's political power grows, and, when Marco finds a mysterious implant embedded in his back, the memory of what really happened begins to return.	https://image.tmdb.org/t/p/w1280/7gZZ6Qk2TZf4bEXHYbBEFlH8emJ.jpg
5502	2675	A family living on a farm finds mysterious crop circles in their fields which suggests something more frightening to come.	https://image.tmdb.org/t/p/w1280/bY9lCUVUajpkKWlfjWF1mtXaSUp.jpg
3173	9563	A star quarterback gets knocked out of the game and an unknown third stringer is called in to replace him. The unknown gives a stunning performance and forces the aging coach to reevaluate his game plans and life. A new co-owner/president adds to the pressure of winning. The new owner must prove her self in a male dominated world.	https://image.tmdb.org/t/p/w1280/ofxxBtOoNRQD9yuiVIEo8sbsqkK.jpg
8784	401	Andrew returns to his hometown for the funeral of his mother, a journey that reconnects him with past friends. The trip coincides with his decision to stop taking his powerful antidepressants. A chance meeting with Sam - a girl also suffering from various maladies - opens up the possibility of rekindling emotional attachments, confronting his psychologist father, and perhaps beginning a new life.	https://image.tmdb.org/t/p/w1280/u7IASCZ02Q94SYklSIR2609inis.jpg
2381	10587	A new batch of recruits arrives at Police Academy, this time a group of civilian volunteers who have joined Commandant Lassard's new Citizens on Patrol program. Although the community relations project has strong governmental support, a disgusted Captain Harris is determined to see it fail.	https://image.tmdb.org/t/p/w1280/AcvfIPLXGxSucYGSmfkRU2SqLi4.jpg
1544	330	Four years after Jurassic Park's genetically bred dinosaurs ran amok, multimillionaire John Hammond shocks chaos theorist Ian Malcolm by revealing that Hammond has been breeding more beasties at a secret location. Malcolm, his paleontologist ladylove and a wildlife videographer join an expedition to document the lethal lizards' natural behavior in this action-packed thriller.	https://image.tmdb.org/t/p/w1280/u1fXmEQUCI9CjyHCCYOPBSq2DYo.jpg
224	1909	John Arnold DeMarco is a man who believes he is Don Juan, the greatest lover in the world. Clad in a cape and mask, DeMarco undergoes psychiatric treatment with Dr. Jack Mickler to cure him of his apparent delusion. But the psychiatric sessions have an unexpected effect on the psychiatric staff and, most profoundly, Dr Mickler, who rekindles the romance in his complacent marriage.	https://image.tmdb.org/t/p/w1280/fe0TuYz9jCKUba2Omj48K8bWJ8z.jpg
6003	4912	Television made him famous, but his biggest hits happened off screen. Television producer by day, CIA assassin by night, Chuck Barris was recruited by the CIA at the height of his TV career and trained to become a covert operative. Or so Barris said.	https://image.tmdb.org/t/p/w1280/o3Im9nPLAgtlw1j2LtpMebAotSe.jpg
4679	2616	As an idle, good-natured bachelor, Uncle Buck is the last person you would think of to watch the kids. However, during a family crisis, he is suddenly left in charge of his nephew and nieces. Unaccustomed to suburban life, fun-loving Uncle Buck soon charms his younger relatives Miles and Maizy with his hefty cooking and his new way of doing the laundry. His carefree style does not impress everyone though - especially his rebellious teenage niece, Tia, and his impatient girlfriend, Chanice. With a little bit of luck and a lot of love, Uncle Buck manages to surprise everyone in this heartwarming family comedy.	https://image.tmdb.org/t/p/w1280/pfRn0CzYq5n49EDl8BV8Jjry6ZM.jpg
4678	11959	The eccentric new manager of a UHF television channel tries to save the station from financial ruin with an odd array of programming.	https://image.tmdb.org/t/p/w1280/2zFQ9aGCYCKqV7pYf50IuVsy1eV.jpg
4901	1535	On the day of his retirement, a veteran CIA agent learns that his former protégé has been arrested in China, is sentenced to die the next morning in Beijing, and that the CIA is considering letting that happen to avoid an international scandal.	https://image.tmdb.org/t/p/w1280/hsb8hBeU3tkTX8SUYW6YYw6JPYD.jpg
4903	1999	"Summertime on the coast of Maine, ""In the Bedroom"" centers on the inner dynamics of a family in transition. Matt Fowler is a doctor practicing in his native Maine and is married to New York born Ruth Fowler, a music teacher. His son is involved in a love affair with a local single mother. As the beauty of Maine's brief and fleeting summer comes to an end, these characters find themselves in the midst of unimaginable tragedy."	https://image.tmdb.org/t/p/w1280/3UzsHGayLvoInQrgIKd4u2y9BeA.jpg
