2468	10945	Terry works for a bank, and uses computers to communicate with clients all over the world. One day she gets a strange message from an unknown source. The message is coded. After decoding the message, Terry becomes embroiled in an espionage ring. People are killed, and Terry is chased. Throughout she remains in contact with this unknown person, who needs Terry to help save his life.	https://image.tmdb.org/t/p/w1280/nZcBdD3HRA6PPvfDY9UL0PWS5hi.jpg
8169	11548	In a soon to be demolished block of apartments, the residents resist the criminal methods used to force them to leave so a greedy tycoon can build his new skyscraper. When tiny mechanical aliens land for a recharge, they decide to stay and help out.	https://image.tmdb.org/t/p/w1280/6N2HGV0KgCWVg41zAgAuBbwcE3e.jpg
30749	205	Inspired by true events, this film takes place in Rwanda in the 1990s when more than a million Tutsis were killed in a genocide that went mostly unnoticed by the rest of the world. Hotel owner Paul Rusesabagina houses over a thousand refuges in his hotel in attempt to save their lives.	https://image.tmdb.org/t/p/w1280/p3pHw85UMZPegfMZBA6dZ06yarm.jpg
1275	8009	He fought his first battle on the Scottish Highlands in 1536. He will fight his greatest battle on the streets of New York City in 1986. His name is Connor MacLeod. He is immortal.	https://image.tmdb.org/t/p/w1280/6l4t1vWAFMuAiOpDT0mDWlrr5Mp.jpg
6979	860	High School student David Lightman (Matthew Broderick) has a talent for hacking. But while trying to hack into a computer system to play unreleased video games, he unwittingly taps into the Defense Department's war computer and initiates a confrontation of global proportions! Together with his girlfriend (Ally Sheedy) and a wizardly computer genius (John Wood), David must race against time to outwit his opponent...and prevent a nuclear Armageddon.	https://image.tmdb.org/t/p/w1280/rQocmooj7bFKS2vZfzWBB5O12eR.jpg
8798	1538	Cab driver Max picks up a man who offers him $600 to drive him around. But the promise of easy money sours when Max realizes his fare is an assassin.	https://image.tmdb.org/t/p/w1280/fmkv2eRuYCTq7A5jzMBNgoNe1vA.jpg
2352	12560	A couple's marital troubles are put on hold while they host an unhappy reunion of former college pals gathered for the funeral of one of their own, a suicide victim named Alex. As the weekend unfolds, the friends catch up with each other, play the music of their youth, reminisce, smoke marijuana, and pair off with each other.	https://image.tmdb.org/t/p/w1280/rU8kjMEL5Mn0EWm3gOShPHBEZ4l.jpg
3702	9659	In a self-destructing world, a vengeful Australian policeman sets out to stop a violent motorcycle gang.	https://image.tmdb.org/t/p/w1280/5LrI4GiCSrChgkdskVZiwv643Kg.jpg
3703	8810	Max Rockatansky returns as the heroic loner who drives the dusty roads of a postapocalyptic Australian Outback in an unending search for gasoline. Arrayed against him and the other scraggly defendants of a fuel-depot encampment are the bizarre warriors commanded by the charismatic Lord Humungus, a violent leader whose scruples are as barren as the surrounding landscape.	https://image.tmdb.org/t/p/w1280/tVaClEA7n0MxaY8sb81nHwh6XNW.jpg
1884	1878	Raoul Duke and his attorney Dr. Gonzo drive a red convertible across the Mojave desert to Las Vegas with a suitcase full of drugs to cover a motorcycle race. As their consumption of drugs increases at an alarming rate, the stoned duo trash their hotel room and fear legal repercussions. Duke begins to drive back to L.A., but after an odd run-in with a cop, he returns to Sin City and continues his wild drug binge.	https://image.tmdb.org/t/p/w1280/u9ffgobMADj6GCafeImbov566j9.jpg
1882	929	When a freighter is viciously attacked in the Pacific Ocean, a team of experts -- including biologist Niko Tatopoulos and scientists Elsie Chapman and Mendel Craven -- concludes that an oversized reptile is the culprit. Before long, the giant lizard is loose in Manhattan, destroying everything within its reach. The team chases the monster to Madison Square Garden, where a brutal battle ensues.	https://image.tmdb.org/t/p/w1280/5axr56XqJH2xqkzI4j5sjzgV1Hu.jpg
3704	9355	Mad Max becomes a pawn in a decadent oasis of a technological society, and when exiled, becomes the deliverer of a colony of children.	https://image.tmdb.org/t/p/w1280/9ciqnBU2YlMtMrqNwRzhmaMeL9l.jpg
54286	2503	Bourne is brought out of hiding once again by reporter Simon Ross who is trying to unveil Operation Blackbriar, an upgrade to Project Treadstone, in a series of newspaper columns. Information from the reporter stirs a new set of memories, and Bourne must finally uncover his dark past while dodging The Company's best efforts to eradicate him.	https://image.tmdb.org/t/p/w1280/fHho6JYYY0nRcETWSoeI19iZsNF.jpg
2126	8688	All bets are off when corrupt homicide cop Rick Santoro witnesses a murder during a boxing match. It's up to him and lifelong friend and naval intelligence agent Kevin Dunne to uncover the conspiracy behind the killing. At every turn, Santoro makes increasingly shocking discoveries that even he can't turn a blind eye to.	https://image.tmdb.org/t/p/w1280/lCKdTf0Cy3R3kBuw2xmWmbxX6pZ.jpg
2082	10414	After reckless young lawyer Gordon Bombay gets arrested for drunk driving, he must coach a kids hockey team for his community service. Gordon has experience on the ice, but isn't eager to return to hockey, a point hit home by his tense dealings with his own former coach, Jack Reilly. The reluctant Gordon eventually grows to appreciate his team, which includes promising young Charlie Conway, and leads them to take on Reilly's tough players.	https://image.tmdb.org/t/p/w1280/4qXfjDlDEGuN3xRNawh4WZo5o96.jpg
2081	10144	This colorful adventure tells the story of an impetuous mermaid princess named Ariel who falls in love with the very human Prince Eric and puts everything on the line for the chance to be with him. Memorable songs and characters -- including the villainous sea witch Ursula.	https://image.tmdb.org/t/p/w1280/ujlSe3lhp1OKmF2LNu6wRpWbdiU.jpg
3113	9946	On 28 December 1999, the citizens of New York City are getting ready for the turn of the millennium. However, the Devil decides to crash the party by coming to the city, inhabiting a man's body, and searching for his chosen bride—a 20-year-old woman named Christine York. The world will end, and the only hope lies within an atheist named Jericho Cane.	https://image.tmdb.org/t/p/w1280/bEIjH6GroeWaBkn6o7MVpMNbuyw.jpg
44191	752	In a world in which Great Britain has become a fascist state, a masked vigilante known only as “V” conducts guerrilla warfare against the oppressive British government. When V rescues a young woman from the secret police, he finds in her an ally with whom he can continue his fight to free the people of Britain.	https://image.tmdb.org/t/p/w1280/8rI9pNiTmugkEbI249evLygl9TC.jpg
941	32093	Around 1820 the son of a California nobleman comes home from Spain to find his native land under a villainous dictatorship. On the one hand he plays the useless fop, while on the other he is the masked avenger Zorro.	https://image.tmdb.org/t/p/w1280/f0qqNWFWDlS8nEYKRIA2N7FZCy7.jpg
2539	9535	"Countless wiseguy films are spoofed in this film that centers on the neuroses and angst of a powerful Mafia racketeer who suffers from panic attacks. When Paul Vitti needs help dealing with his role in the ""family,"" unlucky shrink Dr. Ben Sobel is given just days to resolve Vitti's emotional crisis and turn him into a happy, well-adjusted gangster."	https://image.tmdb.org/t/p/w1280/eqa4TEgkx63WRhqyD8eTwmL7bUi.jpg
1476	9403	The auto-biographical story of Howard Stern, the radio-rebel who is now also a TV-personality, an author and a movie star.	https://image.tmdb.org/t/p/w1280/d8V9m1DIkXQlFYK8PsCRcJ6rh6d.jpg
8644	2048	In 2035, where robots are common-place and abide by the three laws of robotics, a techno-phobic cop investigates an apparent suicide. Suspecting that a robot may be responsible for the death, his investigation leads him to believe that humanity may be in danger.	https://image.tmdb.org/t/p/w1280/2mkFzf168xJrV6Leqq0bjqOlJCK.jpg
8641	8699	It's the 1970s, and San Diego super-sexist anchorman Ron Burgundy is the top dog in local TV, but that's all about to change when ambitious reporter Veronica Corningstone arrives as a new employee at his station.	https://image.tmdb.org/t/p/w1280/hafNeozn8Q4K6enP2ux5MTMCHjH.jpg
2712	345	After Dr. Bill Hartford's wife, Alice, admits to having sexual fantasies about a man she met, Bill becomes obsessed with having a sexual encounter. He discovers an underground sexual group and attends one of their meetings -- and quickly discovers that he is in over his head.	https://image.tmdb.org/t/p/w1280/ckDkeOD1OyUFU1grX1nyvGreNNQ.jpg
2710	2667	In October of 1994 three student filmmakers disappeared in the woods near Burkittsville, Maryland, while shooting a documentary. A year later their footage was found.	https://image.tmdb.org/t/p/w1280/hyaOKmxuF8YJKHqWlwpiZU5QsAr.jpg
2716	620	"After losing their academic posts at a prestigious university, a team of parapsychologists goes into business as proton-pack-toting ""ghostbusters"" who exterminate ghouls, hobgoblins and supernatural pests of all stripes. An ad campaign pays off when a knockout cellist hires the squad to purge her swanky digs of demons that appear to be living in her refrigerator."	https://image.tmdb.org/t/p/w1280/3FS3oBdorgczgfCkFi2u8ZTFfpS.jpg
2717	2978	Five years after they defeated Gozer, the Ghostbusters are out of business. When Dana begins to have ghost problems again, the boys come out of retirement to aid her and hopefully save New York City from a new paranormal threat.	https://image.tmdb.org/t/p/w1280/4nN0EYNbOWHJ9UO39maO5Kvcdfa.jpg
2718	10490	In a small Minnesota town, the annual beauty pageant is being covered by a TV crew. Former winner Gladys Leeman wants to make sure her daughter follows in her footsteps; explosions, falling lights, and trailer fires prove that. As the Leemans are the richest family in town, the police are pretty relaxed about it all. Despite everything, main rival (but sweet) Amber Atkins won't give up without a fight.	https://image.tmdb.org/t/p/w1280/lWCooTiA6sSLdCA4hzToHKKWBZb.jpg
4238	2043	When a teacher kidnaps a girl from a prestigious school, homicide detective, Alex Cross takes the case and teams up with young security agent, Jezzie Flannigan in hope of finding the girl and stopping the brutal psychopath.	https://image.tmdb.org/t/p/w1280/1ZjDmPKMUtout8hR77qmK1llgls.jpg
8985	36648	For years, Blade has fought against the vampires in the cover of the night. But now, after falling into the crosshairs of the FBI, he is forced out into the daylight, where he is driven to join forces with a clan of human vampire hunters he never knew existed—The Nightstalkers. Together with Abigail and Hannibal, two deftly trained Nightstalkers, Blade follows a trail of blood to the ancient creature that is also hunting him—the original vampire, Dracula.	https://image.tmdb.org/t/p/w1280/4WinsdHQBdh5aTt7Bd7T7dbUXbb.jpg
135	9101	Bumbling Navy lieutenant Tom Dodge has been given one last chance to clean up his record. But Admiral Graham, his nemesis, assigns Dodge to the Stingray, a submarine that can barely keep afloat. To add insult to injury, the Stingray is to be the enemy flagship in the upcoming war games … and to make matters even worse, Dodge's crew is a band of idiots even more incompetent that he is!	https://image.tmdb.org/t/p/w1280/q6JEjedx4LoZRig8U1R5sJqBfti.jpg
8982	15397	Based on Anne Holm's acclaimed young adult novel North to Freedom, I Am David chronicles the struggles of a 12-year-old boy (Ben Tibber) who manages to flee a Communist concentration camp on his own -- through sheer will and determination. All he has in his possession is a loaf of bread, a letter to deliver to someone in Denmark and a compass to help get him there.	https://image.tmdb.org/t/p/w1280/l3W33iOapTaHA4ZxX0vECBfPyoG.jpg
494	2320	Terrorists hijack a 747 inbound to Washington D.C., demanding the the release of their imprisoned leader. Intelligence expert David Grant (Kurt Russell) suspects another reason and he is soon the reluctant member of a special assault team that is assigned to intercept the plane and hijackers.	https://image.tmdb.org/t/p/w1280/wmgkFuEr8bHRAgs1HS5U46Rzo0I.jpg
4226	77	Leonard Shelby is tracking down the man who raped and murdered his wife. The difficulty of locating his wife's killer, however, is compounded by the fact that he suffers from a rare, untreatable form of short-term memory loss. Although he can recall details of life before his accident, Leonard cannot remember what happened fifteen minutes ago, where he's going, or why.	https://image.tmdb.org/t/p/w1280/fQMSaP88cf1nz4qwuNEEFtazuDM.jpg
4223	853	A Russian and a German sniper play a game of cat-and-mouse during the Battle of Stalingrad.	https://image.tmdb.org/t/p/w1280/9cSoNnB31hGY2mL78VT8mAbz6nR.jpg
25	451	Ben Sanderson, an alcoholic Hollywood screenwriter who lost everything because of his drinking, arrives in Las Vegas to drink himself to death. There, he meets and forms an uneasy friendship and non-interference pact with prostitute Sera.	https://image.tmdb.org/t/p/w1280/37qHRJxnSh5YkuaN9FgfNnMl3Tj.jpg
7454	7131	Famed monster slayer Gabriel Van Helsing is dispatched to Transylvania to assist the last of the Valerious bloodline in defeating Count Dracula. Anna Valerious reveals that Dracula has formed an unholy alliance with Dr. Frankenstein's monster and is hell-bent on exacting a centuries-old curse on her family.	https://image.tmdb.org/t/p/w1280/s2OPT5CZsZBQYAIlO9Mv4AimHvV.jpg
1831	2157	The prospects for continuing life on Earth in the year 2058 are grim. So the Robinsons are launched into space to colonize Alpha Prime, the only other inhabitable planet in the galaxy. But when a stowaway sabotages the mission, the Robinsons find themselves hurtling through uncharted space.	https://image.tmdb.org/t/p/w1280/kkBDPkUnYwAkWbYY2bnyf5ANObA.jpg
20	11517	When a vengeful New York transit cop decides to steal a trainload of subway fares, his foster brother—a fellow cop—tries to protect him.	https://image.tmdb.org/t/p/w1280/jSozzzVOR2kfXgTUuGnbgG2yRFi.jpg
21	8012	"Chili Palmer is a Miami mobster who gets sent by his boss, the psychopathic ""Bones"" Barboni, to collect a bad debt from Harry Zimm, a Hollywood producer who specializes in cheesy horror films. When Chili meets Harry's leading lady, the romantic sparks fly. After pitching his own life story as a movie idea, Chili learns that being a mobster and being a Hollywood producer really aren't all that different."	https://image.tmdb.org/t/p/w1280/vWtDUUgQAsVyvRW4mE75LBgVm2e.jpg
23	9691	Assassin Robert Rath arrives at a funeral to kill a prominent mobster, only to witness a rival hired gun complete the job for him -- with grisly results. Horrified by the murder of innocent bystanders, Rath decides to take one last job and then return to civilian life. But finding his way out of the world of contract killing grows ever more dangerous as Rath falls for his female target and becomes a marked man himself.	https://image.tmdb.org/t/p/w1280/xAx5MP7Dg4y85pyS7atX6eWk4Qd.jpg
55118	2252	A Russian teenager, living in London, dies during childbirth but leaves clues to a midwife in her journal, that could tie her child to a rape involving a violent Russian mob family.	https://image.tmdb.org/t/p/w1280/AnYpxr2efiY1MEHGsSrwPF8pDFY.jpg
3793	36657	Two mutants, Rogue and Wolverine, come to a private academy for their kind whose resident superhero team, the X-Men, must oppose a terrorist organization with similar powers.	https://image.tmdb.org/t/p/w1280/k01Q6ATbfzNJgw4Zuoj0LTY3T9x.jpg
2406	9326	Though she can spin wild tales of passionate romance, novelist Joan Wilder has no life of her own. Then one day adventure comes her way in the form of a mysterious package. It turns out that the parcel is the ransom she'll need to free her abducted sister, so Joan flies to South America to hand it over. But she gets on the wrong bus and winds up hopelessly stranded in the jungle.	https://image.tmdb.org/t/p/w1280/3TqpkTYiltYsxYatdug6WDgdRKL.jpg
1370	1573	Off-duty cop John McClane is gripped with a feeling of déjà vu when, on a snowy Christmas Eve in the nation’s capital, terrorists seize a major international airport, holding thousands of holiday travelers hostage. Renegade military commandos led by a murderous rogue officer plot to rescue a drug lord from justice and are prepared for every contingency except one: McClane’s smart-mouthed heroics.	https://image.tmdb.org/t/p/w1280/zSgL998DXaljsCmwQuwDM8Ak4rV.jpg
405	8011	Starts off in the 15th century, with Connor McLeod (Christopher Lambert) training with another immortal swordsman, the Japanese sorcerer Nakano (Mako). When an evil immortal named Kane (Mario Van Peebles) kills the old wizard, the resulting battle leaves him buried in an underground cave. When Kane resurfaces in the 20th century to create havoc, it's up to McLeod to stop him.	https://image.tmdb.org/t/p/w1280/8ZeckjmtObR3QPjzSm4X656vFS2.jpg
1372	174	On the eve of retirement, Kirk and McCoy are charged with assassinating the Klingon High Chancellor and imprisoned. The Enterprise crew must help them escape to thwart a conspiracy aimed at sabotaging the last best hope for peace.	https://image.tmdb.org/t/p/w1280/5PvIZAOFDe63M1oByFEFDoQobkc.jpg
1375	157	Admiral Kirk and his bridge crew risk their careers stealing the decommissioned Enterprise to return to the restricted Genesis planet to recover Spock's body.	https://image.tmdb.org/t/p/w1280/b9ZaPiD6AaZR7CgQP5P4Kg893QL.jpg
1374	154	Admiral James T. Kirk is feeling old; the prospect of accompanying his old ship the Enterprise on a two week cadet cruise is not making him feel any younger. But the training cruise becomes a life or death struggle when Khan escapes from years of exile and captures the power of creation itself.	https://image.tmdb.org/t/p/w1280/7VKpj4Xl3hTzgAS3xpVuOyqNnSv.jpg
1377	364	Having defeated the Joker, Batman now faces the Penguin - a warped and deformed individual who is intent on being accepted into Gotham society. Crooked businessman Max Schreck is coerced into helping him become Mayor of Gotham and they both attempt to expose Batman in a different light. Selina Kyle, Max's secretary, is thrown from the top of a building and is transformed into Catwoman - a mysterious figure who has the same personality disorder as Batman. Batman must attempt to clear his name, all the time deciding just what must be done with the Catwoman.	https://image.tmdb.org/t/p/w1280/jKBjeXM7iBBV9UkUcOXx3m7FSHY.jpg
1376	168	Fugitives of the Federation for their daring rescue of Spock from the doomed Genesis Planet, Admiral Kirk (William Shatner) and his crew begin their journey home to face justice for their actions. But as they near Earth, they find it at the mercy of a mysterious alien presence whose signals are slowly destroying the planet. In a desperate attempt to answer the call of the probe, Kirk and his crew race back to the late twentieth century. However they soon find the world they once knew to be more alien than anything they've encountered in the far reaches of the galaxy!	https://image.tmdb.org/t/p/w1280/62nATuMKuaLhd5VHKumHOrJnCZa.jpg
2011	165	Marty and Doc are at it again in this wacky sequel to the 1985 blockbuster as the time-traveling duo head to 2015 to nip some McFly family woes in the bud. But things go awry thanks to bully Biff Tannen and a pesky sports almanac. In a last-ditch attempt to set things straight, Marty finds himself bound for 1955 and face to face with his teenage parents -- again.	https://image.tmdb.org/t/p/w1280/k5dzvCQkXU2CAhLtlj9BHE7xmyK.jpg
2012	196	The final installment of the Back to the Future trilogy finds Marty digging the trusty DeLorean out of a mineshaft and looking for Doc in the Wild West of 1885. But when their time machine breaks down, the travelers are stranded in a land of spurs. More problems arise when Doc falls for pretty schoolteacher Clara Clayton, and Marty tangles with Buford Tannen.	https://image.tmdb.org/t/p/w1280/6DmgPTZYaug7QNDjOhUDWyjOQDl.jpg
3835	33408	A precocious and obsessive teenager develops a crush on a naive writer with harrowing consequences.	https://image.tmdb.org/t/p/w1280/7DGYohz2tyo0mpkVxsccqBTf9vl.jpg
356	13	A man with a low IQ has accomplished great things in his life and been present during significant historic events—in each case, far exceeding what anyone imagined he could do. But despite all he has achieved, his one true love eludes him.	https://image.tmdb.org/t/p/w1280/yE5d3BUhE8hCnkMUJOo1QDoOGNz.jpg
5388	320	Two Los Angeles homicide detectives are dispatched to a northern town where the sun doesn't set to investigate the methodical murder of a local teen.	https://image.tmdb.org/t/p/w1280/zb0D3vfjcPFvuyHp1mFPOIcYJWH.jpg
2746	10776	Seymour Krelborn is a nerdy orphan working at Mushnik's, a flower shop in urban Skid Row. He harbors a crush on fellow co-worker Audrey Fulquard, and is berated by Mr. Mushnik daily. One day as Seymour is seeking a new mysterious plant, he finds a very mysterious unidentified plant which he calls Audrey II. The plant seems to have a craving for blood and soon begins to sing for his supper.	https://image.tmdb.org/t/p/w1280/iKkbN17OmFosaW6asCNZTTsyvpu.jpg
455	1634	When maladjusted orphan Jesse vandalizes a theme park, he is placed with foster parents and must work at the park to make amends. There he meets Willy, a young Orca whale who has been separated from his family. Sensing kinship, they form a bond and, with the help of kindly whale trainer Rae Lindley, develop a routine of tricks. However, greedy park owner Dial soon catches wind of the duo and makes plans to profit from them.	https://image.tmdb.org/t/p/w1280/vIjiTSNA52VGGP9eeegNaMKXNhf.jpg
5995	423	The true story of pianist Wladyslaw Szpilman's experiences in Warsaw during the Nazi occupation. When the Jews of the city find themselves forced into a ghetto, Szpilman finds work playing in a café; and when his family is deported in 1942, he stays behind, works for a while as a laborer, and eventually goes into hiding in the ruins of the war-torn city.	https://image.tmdb.org/t/p/w1280/hfMeo073RxKKjZZV4gSGema1yog.jpg
4033	11973	The story of the Cuban Missile Crisis in 1962—the nuclear standoff with the USSR sparked by the discovery by the Americans of missile bases established on the Soviet-allied island of Cuba.	https://image.tmdb.org/t/p/w1280/37yRUulECxF96eIok4ZXB8nRJ11.jpg
4034	1900	An exploration of the United States of America's war on drugs from multiple perspectives. For the new head of the Office of National Drug Control Policy, the war becomes personal when he discovers his well-educated daughter is abusing cocaine within their comfortable suburban home. In Mexico, a flawed, but noble policeman agrees to testify against a powerful general in league with a cartel, and in San Diego, a drug kingpin's sheltered trophy wife must learn her husband's ruthless business after he is arrested, endangering her luxurious lifestyle.	https://image.tmdb.org/t/p/w1280/9qPLd5hdXIlrAyknVWK38eZyUMo.jpg
48696	1440	The lives of two lovelorn spouses from separate marriages, a registered sex offender, and a disgraced ex-police officer intersect as they struggle to resist their vulnerabilities and temptations.	https://image.tmdb.org/t/p/w1280/225OXhGllrBJ6FWaYyiosxDU1us.jpg
52950	2269	A man who serves in the war between the forces of Light and Dark comes into possession of a device that can restore life to Moscow, which was nearly destroyed by an apocalyptic event.	https://image.tmdb.org/t/p/w1280/9TBOWJUa4igq9FkDWhZRK72K4vQ.jpg
52952	11798	A story about a troubled boy growing up in England, set in 1983. He comes across a few skinheads on his way home from school, after a fight. They become his new best friends even like family. Based on experiences of director Shane Meadows.	https://image.tmdb.org/t/p/w1280/wVc7lwmTgDN7QY4G9V8dfYynDec.jpg
5999	16225	Upon discovery of a shard of what could be the Loc-Nar, a miner named Tyler becomes possessed with an insatiable hunger for power and a thirst for immortality. On his way to the planet of youth, Tyler wipes out most of a space colony and kidnaps a beautiful young woman. His only mistake is that he doesn't kill her sister, Julie, who then sets out on a mission of rescue and revenge.	https://image.tmdb.org/t/p/w1280/CDv2U64QX6ZzbgWbz4licizkX6.jpg
48516	1422	To take down South Boston's Irish Mafia, the police send in one of their own to infiltrate the underworld, not realizing the syndicate has done likewise. While an undercover cop curries favor with the mob kingpin, a career criminal rises through the police ranks. But both sides soon discover there's a mole among them.	https://image.tmdb.org/t/p/w1280/tGLO9zw5ZtCeyyEWgbYGgsFxC6i.jpg
3249	11087	A suburban family chooses seemingly sweet Peyton Flanders as their newborn's nanny. Only much later does the infant's mother, Claire Bartel, realize Peyton's true intentions -- to destroy Claire and replace her in the family. The nail-biting suspense builds quickly in this chilling psychological thriller about deception and bitter revenge.	https://image.tmdb.org/t/p/w1280/mKNDQjZ49UdkbH6SPC9wbxtcp39.jpg
3248	6279	Deloris Van Cartier is again asked to don the nun's habit to help a run-down Catholic school, presided over by Mother Superior. And if trying to reach out to a class full of uninterested students wasn't bad enough, the sisters discover that the school is due to be closed by the unscrupulous local authority chief Mr. Crisp.	https://image.tmdb.org/t/p/w1280/tLbvfUYw8Pr7DMI5TGL5DX1bx5S.jpg
